{
  "$schema": "../schemas/challenge-set.schema.json",
  "id": "4040a75a-037c-44c0-b1e2-bdcc6ceaddb0",
  "slug": "pentesting",
  "name": "Penetration Testing",
  "description": "Challenge set that focuses on Penetration Testing Utilities",
  "version": "0.1.0",
  "challenges": [
    "strings",
    "binwalk",
    "hash-identifier"
  ]
}
